[
  {
    "name": "pop.tfr_target",
    "symbol": "TFR_T",
    "value": null,
    "unit": "births per woman",
    "distribution": "triangular",
    "low": 1.2,
    "high": 2.1,
    "source_id": null,
    "assumption": true,
    "justification": "Bracket between very low observed fertility and replacement level (2.1); family triangular chosen as least informative bounded distribution.",
    "component": "population",
    "role": "random",
    "needs_source": false,
    "assumption_id": "A01"
  },
  {
    "name": "pop.kappa_f",
    "symbol": "kappa_F",
    "value": null,
    "unit": "1/year",
    "distribution": "fixed",
    "low": 0.02,
    "high": 0.1,
    "source_id": null,
    "assumption": true,
    "justification": "Fitted to the 1990-2005 fertility path; sensitivity range 0.02 to 0.10.",
    "component": "population",
    "role": "calibrated",
    "needs_source": false,
    "assumption_id": "A02"
  },
  {
    "name": "pop.e0_max",
    "symbol": "e0_max",
    "value": null,
    "unit": "years",
    "distribution": "fixed",
    "low": 85.0,
    "high": 90.0,
    "source_id": null,
    "assumption": true,
    "justification": "Asymptote of life expectancy; parsimonious single-level parameter with sensitivity range 85 to 90 years.",
    "component": "population",
    "role": "fixed",
    "needs_source": false,
    "assumption_id": "A03"
  },
  {
    "name": "pop.kappa_e",
    "symbol": "kappa_e",
    "value": null,
    "unit": "1/year",
    "distribution": "triangular",
    "low": 0.01,
    "high": 0.04,
    "source_id": null,
    "assumption": true,
    "justification": "Spread of life_expectancy_at_birth variants once loaded; family triangular chosen as least informative bounded distribution.",
    "component": "population",
    "role": "random",
    "needs_source": false,
    "assumption_id": "A04"
  },
  {
    "name": "pop.mig_rate",
    "symbol": "m",
    "value": null,
    "unit": "per 1,000 population per year",
    "distribution": "triangular",
    "low": -1.0,
    "high": 2.0,
    "source_id": null,
    "assumption": true,
    "justification": "Wide bracket around zero because no verified historical series exists; family triangular chosen as least informative bounded distribution.",
    "component": "population",
    "role": "random",
    "needs_source": false,
    "assumption_id": "A05"
  },
  {
    "name": "gro.alpha",
    "symbol": "alpha",
    "value": null,
    "unit": "fraction",
    "distribution": "fixed",
    "low": 0.3,
    "high": 0.45,
    "source_id": null,
    "assumption": true,
    "justification": "Usual bracket for capital share in growth accounting literature; sensitivity range 0.30 to 0.45.",
    "component": "growth",
    "role": "fixed",
    "needs_source": false,
    "assumption_id": "A07"
  },
  {
    "name": "gro.delta",
    "symbol": "delta",
    "value": null,
    "unit": "1/year",
    "distribution": "fixed",
    "low": 0.03,
    "high": 0.08,
    "source_id": null,
    "assumption": true,
    "justification": "Bracket for annual depreciation rate of mixed physical capital; sensitivity range 0.03 to 0.08.",
    "component": "growth",
    "role": "fixed",
    "needs_source": false,
    "assumption_id": "A08"
  },
  {
    "name": "gro.rho",
    "symbol": "rho(g_A, s)",
    "value": null,
    "unit": "correlation",
    "distribution": "fixed",
    "low": 0.0,
    "high": 0.5,
    "source_id": null,
    "assumption": true,
    "justification": "Weak positive co-movement between TFP growth and investment rate to avoid independent extremes; sensitivity range 0.0 to 0.5.",
    "component": "growth",
    "role": "fixed",
    "needs_source": false,
    "assumption_id": "A11"
  },
  {
    "name": "gro.s",
    "symbol": "s",
    "value": null,
    "unit": "fraction of Y_core",
    "distribution": "triangular",
    "low": 0.12,
    "high": 0.25,
    "source_id": null,
    "assumption": true,
    "justification": "Bracket for investment rate as fraction of core GDP; family triangular chosen as least informative bounded distribution.",
    "component": "growth",
    "role": "random",
    "needs_source": false,
    "assumption_id": "A09"
  },
  {
    "name": "gro.gA",
    "symbol": "g_A",
    "value": null,
    "unit": "fraction per year",
    "distribution": "triangular",
    "low": -0.005,
    "high": 0.02,
    "source_id": null,
    "assumption": true,
    "justification": "Scenario driver; dispersion set from forecast_vintages errors, location from base_rates; family triangular chosen as least informative bounded distribution.",
    "component": "growth",
    "role": "random",
    "needs_source": false,
    "assumption_id": "A10"
  },
  {
    "name": "hdi.educ_target",
    "symbol": "E_T",
    "value": null,
    "unit": "index 0-1",
    "distribution": "fixed",
    "low": 0.85,
    "high": 1.0,
    "source_id": null,
    "assumption": true,
    "justification": "Long-run education index target asymptote; sensitivity range 0.85 to 1.00.",
    "component": "hdi",
    "role": "fixed",
    "needs_source": false,
    "assumption_id": "A28"
  },
  {
    "name": "hdi.kappa_educ",
    "symbol": "kappa_E",
    "value": null,
    "unit": "1/year",
    "distribution": "fixed",
    "low": 0.01,
    "high": 0.05,
    "source_id": null,
    "assumption": true,
    "justification": "Speed of education index convergence; sensitivity range 0.01 to 0.05.",
    "component": "hdi",
    "role": "fixed",
    "needs_source": false,
    "assumption_id": "A28"
  },
  {
    "name": "res.pi_a",
    "symbol": "a",
    "value": null,
    "unit": "logit",
    "distribution": "fixed",
    "low": null,
    "high": null,
    "source_id": null,
    "assumption": false,
    "justification": "Base rate intercept of project reaching production by stage; requires empirical research source on historical mining and energy project advancement.",
    "component": "resources",
    "role": "fixed",
    "needs_source": true,
    "assumption_id": "A17"
  },
  {
    "name": "res.pi_b",
    "symbol": "b",
    "value": null,
    "unit": "logit per rank",
    "distribution": "fixed",
    "low": null,
    "high": null,
    "source_id": null,
    "assumption": false,
    "justification": "Slope of project advancement probability per stage rank; requires empirical research source.",
    "component": "resources",
    "role": "fixed",
    "needs_source": true,
    "assumption_id": "A17"
  },
  {
    "name": "res.delay",
    "symbol": "D_p",
    "value": null,
    "unit": "years",
    "distribution": "triangular",
    "low": 0.0,
    "high": 6.0,
    "source_id": null,
    "assumption": true,
    "justification": "Project start delay beyond announced start year; family triangular chosen as least informative bounded distribution.",
    "component": "resources",
    "role": "random",
    "needs_source": false,
    "assumption_id": "A18"
  },
  {
    "name": "res.util",
    "symbol": "u",
    "value": null,
    "unit": "fraction",
    "distribution": "triangular",
    "low": 0.5,
    "high": 1.0,
    "source_id": null,
    "assumption": true,
    "justification": "Utilization rate after production ramp-up; family triangular chosen as least informative bounded distribution.",
    "component": "resources",
    "role": "random",
    "needs_source": false,
    "assumption_id": "A19"
  },
  {
    "name": "res.ramp",
    "symbol": "ramp",
    "value": null,
    "unit": "years",
    "distribution": "fixed",
    "low": 1.0,
    "high": 5.0,
    "source_id": null,
    "assumption": true,
    "justification": "Linear ramp-up duration from first production to plateau capacity; sensitivity range 1 to 5 years.",
    "component": "resources",
    "role": "fixed",
    "needs_source": false,
    "assumption_id": "A20"
  },
  {
    "name": "res.decline_oil",
    "symbol": "d_oil",
    "value": null,
    "unit": "1/year",
    "distribution": "fixed",
    "low": null,
    "high": null,
    "source_id": null,
    "assumption": false,
    "justification": "Annual exponential post-plateau decline rate for oil projects; requires empirical basin/well data source.",
    "component": "resources",
    "role": "fixed",
    "needs_source": true,
    "assumption_id": "A21"
  },
  {
    "name": "res.decline_gas",
    "symbol": "d_gas",
    "value": null,
    "unit": "1/year",
    "distribution": "fixed",
    "low": null,
    "high": null,
    "source_id": null,
    "assumption": false,
    "justification": "Annual exponential post-plateau decline rate for gas projects; requires empirical basin/well data source.",
    "component": "resources",
    "role": "fixed",
    "needs_source": true,
    "assumption_id": "A21"
  },
  {
    "name": "res.yield_g_soy",
    "symbol": "g_y",
    "value": null,
    "unit": "1/year",
    "distribution": "triangular",
    "low": -0.005,
    "high": 0.02,
    "source_id": null,
    "assumption": true,
    "justification": "Agricultural yield growth rate for soy; family triangular chosen as least informative bounded distribution.",
    "component": "resources",
    "role": "random",
    "needs_source": false,
    "assumption_id": "A22"
  },
  {
    "name": "res.yield_g_wheat",
    "symbol": "g_y",
    "value": null,
    "unit": "1/year",
    "distribution": "triangular",
    "low": -0.005,
    "high": 0.02,
    "source_id": null,
    "assumption": true,
    "justification": "Agricultural yield growth rate for wheat; family triangular chosen as least informative bounded distribution.",
    "component": "resources",
    "role": "random",
    "needs_source": false,
    "assumption_id": "A22"
  },
  {
    "name": "res.yield_g_corn",
    "symbol": "g_y",
    "value": null,
    "unit": "1/year",
    "distribution": "triangular",
    "low": -0.005,
    "high": 0.02,
    "source_id": null,
    "assumption": true,
    "justification": "Agricultural yield growth rate for corn; family triangular chosen as least informative bounded distribution.",
    "component": "resources",
    "role": "random",
    "needs_source": false,
    "assumption_id": "A22"